,title,internal_id,url,description,responsibilities,qualifications,direction,company,depart_company,LocationName,publish_date
194,Cainiao Network Business Development Manager Tokyo,hCkZaiN%2F6m9yTGqX5ulSsA%3D%3D,https://careers.alibaba.com/positionDetail.htm?positionId=hCkZaiN%2F6m9yTGqX5ulSsA%3D%3D,"菜鸟日本作为菜鸟国际供应链大家庭的一员，为天猫国际，考拉海购，Lazada等阿里系跨境电商平台及日本当地客户提供端到端全链路的跨境电商及一般贸易的国际物流咨询和履约的服务。菜鸟日本具备从BD,解决方案到运营的全链路服务的人才组织结构。近几年随着业务的迅速发展，菜鸟平台在日本的影响力也在急速扩大，我们诚聘具备国际化视野，深耕日本本地市场，愿意和菜鸟共同成长的优秀人才加入。 团队介绍 1、根据公司市场战略，开拓新客户； 2、制定目标客户的销售策略和销售计划，完成销售指标； 3、建立与维护客户渠道，保持与客户的良好合作关系； 4、及时了解客户需求，准确地传达信息，协调公司内部各部门与客户的沟通； 5、负责所辖市场信息的收集，和竞争对手的分析报告。 【募集ポジション】 事業開発マネージャー（Business Development） 【日文】 1、マーケット攻略の戦略をたて、それに基づき新規顧客開拓 2、顧客毎の売上目標、計画を立て、実際に実行する 3、顧客から信頼を勝ち取り、良好な関係を築く 4、顧客のニーズを汲み取り、すぐに社内共有し、解決策を提案する 5、日本市場の分析、競合他社の分析",Nan,【勤務地】 東京都中央区京橋（京橋駅直結の京橋エドグラン） 职位描述 Position Requirement 1、5年以上销售或运营经验，熟悉国际物流、快递、跨境电商、快速消费品、零售行业、咨询行业、时尚行业等优先；有大客户管理经验优先; 2、具备一定的商务沟通、销售、谈判能力; 3、具备一定的市场分析和判断能力; 4、具备独立进行方案策划，并向客户提案的能力； 5、良好的客户服务意识；主动性强，能承受工作压力； 6、良好的口语和书面能力，日文和中文必须； 【必須スキル】 1、5年以上の事業開発、大口顧客の管理、国際物流、越境ECの経験 2、高いビジネスコミュニケーション能力と判断力 3、市場分析、競合分析能力 4、計画立案能力、プレゼン能力 5、自立して動き、積極的に顧客とコミュニケーションをとる能力 6、高い日本語、中国語能力,Sales - Direct sales,Alibaba,日本BD,"Tokyo,Japan",Nan
195,Cainiao Customer Operation (Senior) Specialist Europe & Southeast Asia,SBiCuvshEe%2FZYqeCl_JJ_w%3D%3D,https://careers.alibaba.com/positionDetail.htm?positionId=SBiCuvshEe%2FZYqeCl_JJ_w%3D%3D,"- Achieving result in not only forming logistic development plan / roadmap with business team and leading internally / externally on key projects to drive for logistics service building / launching with operation team to improve logistics service competitiveness and experience. - Responsible for inventing and executing different approaches to collect both external and internal key performance data and Customer' feedback, identify their experience pain points, and provide strategical recommendation and lead projects to rectify logistic pain points to continuously improve logistics service experience to ensure long term success. - Analysis and closely monitor Customer’s performance to tackle Customer’s performance issues and drive for process improvement. - Communicate ideas and findings in a logical and structured manner. - Work as major proactive communication channel with on-boarded Customers, on abnormal cases resolving, Customer performance improvement, promo arrangement etc… to improvement Customer’s performance. - Owner on Logistics service build up / launching, Customer experience & Customer related KPI including NPS, NR, complaint rate etc…",Nan,"Qualifications: - Experienced in ecommerce logistics industry and well understanding of Customer demand and value. - Strong curiosity to understand the “whys” and “hows” to create initiatives, projects and features with excellence oriented. - Strong ability to learn and execute. - Self-motivated with a “can-do"" attitude. - Travel within EU adapted. Knowledge and Skills Requirements: - Strong problem-solving skills. - Strong collaboration across multiple groups and business partner skills, including excellent interpersonal skills. - Experienced in project management. - Experienced in writing slides and presentation skills. - Good data analytical skill is a plus; e. g. SQL. - Fluent in English, Spanish or French is a plus.",Integration - Logistics,Alibaba,西南欧区域,"Madrid,Spain",Nan
196,Cainiao Network Regional Billing Solutions Manager Europe,9zsEoLHkkFTqwfi46NDLLg%3D%3D,https://careers.alibaba.com/positionDetail.htm?positionId=9zsEoLHkkFTqwfi46NDLLg%3D%3D,"As an overseas regional Billing Solutions Manager, the candidate would be responsible for contract billing and settlement in support of logistics and supply chain business operations. The processes and data flows are operated in multiple legal entities with involvement of a number of stakeholders in different locations within the region. Job Responsibilities 1. Work with finance leader to represent and oversee all aspects of contract billing, settlement and system solutions. 2. Cooperate with business, product and IT teams to evaluate the best practical billing solutions for different logistics scenarios. 3. Coordinate PD and programmers to transform settlement schemes into settlement products. Complete UAT and implement the products. 4. Lead settlement operation team to work on price configuration, resolving reconciliation with customers and logistics partners, accurate billing, on-time collection and payment, etc. 5. Other work related to billing solution, planning and process, and improve the process to meet with the business developments. 6. Being a key & proactive role for business performance improvement, implementation of business strategic initiatives and tactical plans, etc.",Nan,"Basic Qualifications 1. WIth 5+ years of experience in relevant billing or finance fields. 2. Excellent interpersonal and communication skills. Proactively work under pressure to meet deadlines of multi-task. 4. Strong business sense, integrity and decision thinking. Taking ownership and delivering results in a leadership role. 5. Proficient verbal and written English. Preferred Qualifications 1. Experience from a large fast-paced company would be a plus. 2. Rich project management or billing system implementation experience would be preferred. 3. Proven working experience within the logistics, supply chain, e-commerce or TMT industries would be an advantage.",Integration - Integrated management,Alibaba,供应链财务,"Amsterdam,Netherlands",Nan
197,Cainiao Transportation Operation Specialist Europe & Southeast Asia,4d0VS8AmZQceFw3UOrBiMw%3D%3D,https://careers.alibaba.com/positionDetail.htm?positionId=4d0VS8AmZQceFw3UOrBiMw%3D%3D,1. Owning and managing the relationship between CAINIAO and our transportation companies. 2. Own the network carrier portfolio strategy and ensure internal technical stakeholders are engaged to deliver solutions.,Nan,"1. Possess the professional qualification of road transportation for goods (""competencia profesional para el trasnporte de mercacias por carretera""). 2. Strong analytical / quantitative skills. Desire to manage a complex stakeholder environment.",Logistics-Transportation Operation,Alibaba,西班牙国家运营,"Barcelona,Spain",Nan
198,菜鸟网络 中台BU财务专家 杭州,nKbgeDK8GKG4nwlAyYOWJg%3D%3D,https://careers.alibaba.com/positionDetail.htm?positionId=nKbgeDK8GKG4nwlAyYOWJg%3D%3D,1、财务管理： 负责所支持业务线的年度预算，并跟踪预算执行情况及滚动预测，适时预警；对具体业务部门资源的使用情况、重点项目及资源投入产出进行分析评估，提供财务方案，协助业务部门正确决策；通过数据化运营分析，推动业务团队持续降低资源成本，提升资源运营效率； 2、风险管理 ：对业务项目需求有专业判断及方案，对采购策略及风险，以财务的角色参与，控制采购风险，并把控采购合同的权利义务。 3、业务支持 ：作为业务部门的合作伙伴，能全面深入理解业务实质，和业务部门进行有效互动、建立良好的合作关系，对业务部门面临的问题或需求，能及时提供解决方案或者预见性建议。 4、流程优化 ：能够独立完成对所支持业务及相关财务流程的整体优化，发掘并把控风险点，建立 / 完善相应制度或方案，推动流程系统化，提升效率。,Nan,1、 5年以上相关财务工作经验，具有全面的财务专业知识、财务管理经验，深入的数据分析，项目管理和跨团队沟通能力； 2、具备很强的学习能力、适应能力和逻辑分析能力，能够承受工作压力； 3、四大或知名企业工作经验者优先； 4、良好的沟通和人际交往能力，乐观、自信，良好的团队协作精神。,Integration - Integrated management,Alibaba,总账&财务分析,"Hangzhou,Zhejiang,China",Nan
199,蚂蚁集团 数字科技线 国际支付产品专家,ExgejBNYOpQQcK8I%2FNtw%2FA%3D%3D,https://careers.alibaba.com/positionDetail.htm?positionId=ExgejBNYOpQQcK8I%2FNtw%2FA%3D%3D,1. 负责Trusple平台B2B跨境支付产品线。根据客户需求和业务战略，设计B类跨境支付产品并持续优化支付体验。 2. 敏锐洞察客户和行业变化趋势，结合跨境支付特性有针对性进行产品规划和设计。 3. 具有创新性思维，升级、重构传统跨境支付方案，保障资金安全的同时在降本提效方面带来新突破。 4. 承担产品规划、用户调研、商业分析、解决方案、功能与流程设计等工作，并负责产品相关的项目跟进与管理； 5. 协调运营、UED、技术等团队以及其他关联产品，整合资源，推动产品落地；,Nan,1. 本科以上学历，Young&Smart，有3年以上跨境支付、结算产品或5年以上互联网平台型产品设计与落地经验； 2. 有较高的逻辑分析和创新能力， 对互联网产品及行业触觉敏锐、思维活跃、条理清晰，面对问题能快速给出合理解决方案并转化为产品能力； 3. 具有良好的跨团队沟通和协调能力，主动推进能力和抗压能力强； 4. 有跨境电商、Fintech、交易及支付平台相关产品经验优先，有海外留学和工作背景优先. 5. 英文流利。,Products - Platform types,Alibaba,贸易金融业务部,"Hangzhou,Zhejiang,China",Nan
200,Ververica Software Engineer Berlin,e11kpVy47XRsDt2wWFwpeQ%3D%3D,https://careers.alibaba.com/positionDetail.htm?positionId=e11kpVy47XRsDt2wWFwpeQ%3D%3D,"We are seeking full-time Software Engineers to join our development teams at Ververica. In this role, you will work on building data-intensive solutions and report to the Head of Engineering. We believe in a flat hierarchy and create teams around subject matters expertise. You will have the opportunity to become part of one of the biggest and most active open source communities and do work that has a visible impact. Connect with users around the world and contribute to bleeding-edge tech or be an advocate for new approaches to long-standing problems. We are a highly motivated software company originally from Berlin, Germany now operating globally. We love open source but understand commercial needs as well. We are following an open-core business model looking for additional talents helping us achieve our goals and that of our parent company. We are not a start-up anymore, your employment is backed by one of the largest tech companies. At Ververica we embrace diversity and diversity embraces us. If you feel you can add to it, please apply! And if not, still apply – we love diverse skills just as much. The work As Software Engineer you like working on bleeding-edge technology in unified data processing (batch / stream), event-driven applications, data-intensive systems, and machine learning. You will be part of shaping the direction of the data stream processing space. What you will do all day is … … to use your experience to solve challenging data engineering and stream processing problems for our customers, … working on open source and closed source products, … taking end-to-end responsibility (problem breakdown, design, implementation, testing, documentation) for new features, improvements, and fixes, … coordinating across groups of developers (depending on level), … taking ownership of components of the projects / products, including shaping their direction, … being a mentor to junior developers to help them grow, … getting support in becoming an active member of the Apache Flink community, … if interested, speaking, and writing about your work internally and externally.",Nan,"You will love this job if you … … have several years of industry experience, or academic experience, … bring a deep understanding of Java and JVM mechanics, … have good knowledge of distributed and database systems, … have experience in building data-intensive applications or solutions, … are a good programmer, have a good grasp of data structures and algorithms, … have software engineering skills like - knowing how to write clean, testable, and maintainable code - writing documentation - having experience in breaking down complex tasks into well-defined sub-problems - understanding of simple and robust designs, including designing APIs … can debug and fix complex problems in distributed systems, … can mentor other developers, teach them through collaboration, … are interested in open source, working with users, and excited about the opportunity, open source offers to them.",Technology - Development,Alibaba,Ververica,"Berlin,Germany",Nan
201,蚂蚁集团 澳门银行内审专家 国际事业群,2DGBinIqUVcVRAUIA3C0yw%3D%3D,https://careers.alibaba.com/positionDetail.htm?positionId=2DGBinIqUVcVRAUIA3C0yw%3D%3D,任職職責： 1、監察各項業務運作，准确识别关键风险，负责全面评估和持续监督開展內部審計工作，制定以风险导向的審計計劃和审计范围，根据内部审计章程和审计方法论开展審計项目，运用證據及数据分析发现问题根因，推动整改，並編寫審計報告。 2、督促整改，開展後續審計发现跟进工作。 3、负责董事会和监管汇报资料；根据監管和董事会的要求，結合業務發展的需要，實現內審工作的集約高效化管理。 4、为管理层和业务提供合规和风险管理咨询，跟進銀行安排須完成的工作，作为外部审计公司与内部审计部门的沟通桥梁等。,Nan,任職要求： 1、本科以上學歷，審計 / 金融 / IT / 經濟專業，具6年以上監管機構 / 港澳銀行 / 四大會計師事務所之反洗錢、风险管理、财务审计工作經驗，熟悉财务会计知识；持澳門身份證者優先。 2、能清晰理解監管及政府要求，善於把握監管趨勢和重點，具备较强的趋势判断能力，瞭解监管準確需求。 3、有在主導或主要參與過銀行IT內審、內控評價、風險管理工作的實踐經驗，具備CPA資質者優先。 4、熟悉港澳地區銀行內審的工作經驗。 5、具創新精神，主動積極學習和團隊溝通能力，推動解決問題的意願和掌握適宜工作的方式。 6、承擔壓力、兼崗及加班、自主工作、樂於協助團隊成員，能應對並及時實現較為快速的外部監管標準變化和內部管理層要求,Risk Management-Internal Control,Alibaba,澳门银行,Macau,Nan
202,"Alibaba Group Director, Government Relations Europe Paris, France",MIDoPC0YbyG25M8LLbdECw%3D%3D,https://careers.alibaba.com/positionDetail.htm?positionId=MIDoPC0YbyG25M8LLbdECw%3D%3D,"The Senior Manager / Director, Government Relations will report directly to the Head of Government Relations, Europe for the Alibaba Group. This newly created role will ideally be based in Paris, France or Brussels, Belgium. The successful candidate will manage regulatory and political matters at the EU and national levels in areas of relevance to Alibaba. S / He will strategically manage Alibaba’s legislative and regulatory advocacy initiatives across a range of risk environments in Europe, with a specific focus on regulation in the area of digital services, product safety, consumer protection, tax and competition issues. The Senior Manager / Director, Government Relations will be charged with understanding and working effectively within the political dynamics presented by advocating for a global business based in China. This role will also include day-to-day engagement with external resources, such as consultancies and trade associations, as well as any relevant third party relationships. It is important that s / he be able to anticipate risks and opportunities, advise on engagement strategies and advocate on behalf of Alibaba. In addition, the Director, Government Relations will: Work within the GR team to develop and execute a government affairs program for Alibaba in Europe which advances its business growth, legislative and regulatory goals, and political objectives. Translate business goals into results through the development and execution of effective lobbying strategies, political relationship development, and management of contract lobbyists in key jurisdictions. Engage industry and government forums. Establish solid working relationships with colleagues at headquarters and work closely with colleagues internationally to develop and implement industry and government outreach. The outreach will be undertaken with regard to business development, reputation protection, as well as legislative and regulatory objectives. Provide senior executives and colleagues with strategic advice and insightful perspectives concerning government actions and politics regarding the industry and Alibaba in particular.",Nan,"The successful candidate will have at least 10 years of progressively more responsible professional experience. The candidate will possess a background in government relations, and will have spent some time working for a publicly listed company in the digital space. S / He will have a successful track record managing high-level relationships and executing innovative government affairs initiatives to achieve corporate business objectives on both the regulatory and client development fronts. S / He will have significant relevant business and government stakeholder relationship experience. A clear reputation for ethical conduct is required. Specific qualifications include: Strong cultural adaptability and keen learning capacity. Strong decision-making and strategic thinking skills; ability to quickly grasp, address, prioritize and anticipate emerging issues – as well as recommend and suggest changes in strategies as relevant legislative and regulatory processes unfold, with an ability to navigate complex and competitive politics. Solid relationships and a thorough understanding of key parliamentary and regulatory processes, including an understanding of the role and capacity of third party stakeholder entities, including trade associations and other related organizations, to advance the business interests of Alibaba Group. Strong executive presence with excellent oral and written communication skills to represent the company effectively before relevant stakeholders and audiences. In addition to English, proficiency in French, and / or Mandarin language capabilities will be an asset. A collaborative style with an ability to work cross-functionally with subject matter experts, senior leaders and key stakeholders; interactive with the courage and conviction to challenge and defend ideas and strategies; clear reputation for ethical conduct and unquestionable integrity. A track record of strong, demonstrated results in both political and corporate environments Ability to evaluate competing interests of industry players and develop successful strategies to steer around obstacles and obtain desirable outcomes. Possess a keen attention to detail and accuracy in a fast-moving and challenging political and policy environment, with international dimension. Must demonstrate a sense of urgency with the ability to maintain a clear head in stressful situations. Ability to effectively manage multiple ongoing projects at once while appropriately allocating time and resources.",Integration - Corporate affairs,Alibaba,国际政府关系,"Paris,France",Nan
203,"Ant Group Head of Credit Risk Analytics, Scorecards & Model Management Anext Bank",JawPiBr4d2DmuQcheKwQpA%3D%3D,https://careers.alibaba.com/positionDetail.htm?positionId=JawPiBr4d2DmuQcheKwQpA%3D%3D,"As a digital bank, we use credit risk models and analytics for business decisioning, credit underwriting, account management, improving customer experience, and loan provisioning, amongst other activities. While modelling is critical in ensuring that the right tools are developed and used for risk management in line with business objectives, risk analytics plays a key role in identifying, measuring, monitoring and mitigating risks. Key Responsibilities: - Implement the credit risk management framework including ongoing identification, assessment, monitoring and reporting of key credit risk exposure - Conduct portfolio data analysis on post lending accounts to identify the associated credit risks and problems and make appropriate recommendations on risk mitigation - Monitor the performance of the bank’s loan portfolios to ensure compliance with regulations and bank-wide credit risk strategies, policies and manuals - Solicit and analyse market related information on the practice or trend of retail and corporate risk management to make recommendations to Senior Management for procedural reviews - Review and validate credit decision process and credit modelling to identify areas for improvements - Work closely with business teams, product team, data scientists to drive various initiatives to achieve business needs within risk appetite - Manage model risk for scorecards, segmentation, loss forecasting and IRB models including validation, monitoring, managing through limitations and compliance to Model Risk Management Framework - Oversee regular tracking on MIS and key performance metrics of all scoring models, loss forecasting models and risk segmentation models",Nan,"- Degree or above with major in Mathematics, Statistic or Financial Engineering etc. - Minimum 10 years relevant experiences from credit risk analytics and / or modelling in banking - Hands-on experience in the end-to-end development / validation of credit risk models - Sound knowledge of Basel, IFRS9, MAS requirements in relation to models - Firm understanding of credit products in wholesale / SME segment - Good stakeholder management and presentation skills - Proficient in SAS, SQL and other analytical tools (R, SPSS) - CFA or FRM certification will be an added advantage - Self-initiated, excellent analytical skills and ability to handle multiple tasks under tight schedules - Articulate; good command of written and spoken English. - Meticulous, organised and able to produce documentation of high quality with clear and concise messaging - Self-assured with proven ability to interact well with various working levels",Risk Management-Risk Strategy Operation,Alibaba,新加坡银行风险,"Singapore,Singapore",Nan
