,title,internal_id,url,description,responsibilities,qualifications,direction,company,depart_company,LocationName,publish_date
134,Ant Group Senior Compliance Manager International BG,8D8e%2Fp0nyFN8j3F7KehGTw%3D%3D,https://careers.alibaba.com/positionDetail.htm?positionId=8D8e%2Fp0nyFN8j3F7KehGTw%3D%3D,"Based in Singapore, he / she will be part of a growing and dynamic International Compliance team supporting Ant Group’s international business, in particular the provision of payments and financial services to corporate customers. The person reports directly to the Country Head of Compliance, Singapore. We are looking to hire a detail-oriented, hard-working senior compliance professional to join Ant Group’s International Compliance team. This person will work closely with commercial and regulatory lawyers, risk management and other legal / compliance professionals, as well as business and operations teams for Ant Group’s payments businesses. The ideal candidate will be a confident self-starter with strong interpersonal and organizational skills, and demonstrate the ability to effectively and proactively exercise good judgment and partner with the business in a fast-paced environment. Responsibilities: - Support Ant Group business in Singapore and work closely with the other Legal, Compliance (including AML and Privacy) and Risk Management colleagues in PRC and other international markets - Support the agenda of Ant Group International Compliance function, including developing compliance policies and procedures, coordinating with other relevant teams in managing and responding to MAS and other regulators in relation to: - AML / Sanctions compliance, - data privacy, - consumer protection, and - providing compliance regulatory risk assessments and program implementation in Singapore - Lead and support applications for, and continuing maintenance of, payment institutions, payment systems, e-money licences (where applicable) for businesses conducted by Ant Group in Singapore - Drive the regulatory engagement agenda and serve as the point of contact with local regulators, including coordination for any regulator’s on-site inspection, if required - Conduct internal compliance training and education program from time to time",Nan,"- Bachelor Degree in Accounting, Business or Finance; or equivalent work or legal experience - 10 - 15 years of relevant compliance, regulatory or similar experience - Strong regulatory / compliance knowledge and skills - Knowledge of Fintech, payment systems, money transmitter licensing and stored value licensing and similar legal and regulatory requirements in Singapore - Team player with proven ability to work independently - Ability to work under pressure and meet deadlines - Excellent command of both spoken and written English and Mandarin to communicate with our Mandarin-speaking stakeholders - Prior experience with e-commerce, payments or financial services is preferred - Some travelling to China to be expected, when situation permits",Integration - Legal affairs,Alibaba,新加坡区域合规,"Singapore,Singapore",Nan
135,Ant Group Head of Brand Marketing London,pUeg6XvkifFwDaChj_8o2Q%3D%3D,https://careers.alibaba.com/positionDetail.htm?positionId=pUeg6XvkifFwDaChj_8o2Q%3D%3D,"Reporting into our CMO, we’re looking for a forward-thinking Head of Brand Marketing to lead the development and execution of our go to market brand strategy and guardianship. Plan and deliver a multi-channel brand marketing strategy from start to finish, across various channels including social media, email marketing, strategic partnerships, exploring brand collaborations, and working with the group PR team on PR and 360 campaigns to drive awareness and improve brand sentiment Operate as the ""Brand Centre of Excellence"", coordinate cross-functionally to ensure consistency in brand-related decisions and liaise with the regional marketing teams who will be responsible for local implementation of the strategy Day to day owner of all brand assets including but not limited to guidelines, tone of voice, visual identity, messaging frameworks, responsible for keeping up to date and helping to educate colleagues on the correct usage / application of the assets Collaborate with the CMO, Ant Brand Leads and regional marketing leads in developing and adapting the WordFirst Group’s brand strategy for our target markets, including the development of brand value proposition, identity, guidelines Support and coordinate relevant agencies and a team of freelance and in-house creatives to execute against agreed goals Build brand governance and approval guidelines to enable improvements in comms and brand consistency, efficiency, and cross-team collaboration Own and coordinate brand updates / launches Partner with cross-functional teams such as Sales, Product, and Operations to ensure cross-functional alignment and a streamlined and unified customer experience Plan and measure performance KPIs to identify trends, revenue drivers and opportunities and present findings to the marketing, product and leadership teams Own brand tracking and reporting on brand awareness, perceptions and sentiment Stay up-to-date on competitive landscape and market trends while continuing to update and evolve our brand story and shape the brand identity Drive the external comms calendar (including PR activity) and reputation marketing plans in collaboration with HQ and Ant regional brand, PR and government relations colleagues Bring leadership and innovative thinking to the Global Marketing Team Manage, optimize, and effectively deploy the budget for projects Be comfortable working in a matrix style organisation structure and across multiple geographic time-zones Future travel is expected to allow for communication with team members, peers and leadership team members based in other regions",Nan,"Significant (12 years+) industry experience, with at least 5 years of B2B brand marketing and awareness building experience in a digital only or digital first business Strong understanding of platforms, channels, dynamics, and media strategies for brand awareness and marketing campaigns Proven experience building a strong brand identity in the digital B2B space Experience in fintech or payments desirable Demonstrated track record of leadership, working globally and cross-functionally with internal partners Creative storyteller with the ability to influence and shape consumer / customer decisions and build brand advocacy Passionate, quick learner who thrives in a fast-paced, dynamic work environment Entrepreneurial mentality - not afraid to test out new ideas and roll up your sleeves to get stuff done Detail-oriented with strong organizational skills",Market expansion - Market,Alibaba,Global Marketing,"London,England,United Kingdom",Nan
136,Alibaba Group -Marketing Manager-B2B Marketing Team Munich,289cFjgH9x7Q2lNP1CMFXg%3D%3D,https://careers.alibaba.com/positionDetail.htm?positionId=289cFjgH9x7Q2lNP1CMFXg%3D%3D,"About Alibaba. com The first business unit of Alibaba Group, Alibaba. com is a leading platform for global B2B e-commerce that aims to make it easy to do business anywhere. Launched in 1999, Alibaba. com, together with its business partners and entities within its ecosystem, is engaged in services covering all aspects of e-commerce, including providing businesses with tools that help reach a global audience for their products and helping buyers discover products, find suppliers, and place orders online fast and efficiently. It serves millions of buyers and suppliers from over 190 countries and regions around the world. Job Description - You will be responsible for all brand marketing activities in Germany with full budget ownership across channels - You will set up and implement country-specific marketing strategies and define a campaign calendar in line with local initiatives and the global campaign plan aligned with HQ - You will own and manage media buying and planning in the region in close cooperation with our EU and HQ team, media partners and agencies - You will brief, set up and run local campaigns, events and activations to increase Alibaba. com’s relevancy in Germany - You will also work in collaboration with the BD, Partnership and PR team, to ensure your marketing plans are creating positive impact on the business",Nan,"- You have a Degree in business or a marketing related field. - You have a minimum of 5+ years of experience in Marketing, Retail, Business development, Strategy. FMCG, Beauty, Consumer Products or eCommerce experience are a plus. - You bring a strong expertise in the EU market, strong media understanding and passion for great creativity - You are a strong team player who can motivate others and is solution oriented - You have the ability to steer and influence both internal and external stakeholders, resolving issues and working across all functional areas is key in this role - On top of that, your English language skills are excellent, proficient command of the German language is also required. - You are a performance driven, strategic thinker that has excellent project management and analytical skills (proficient with Google suite, MS Office, especially Excel and PowerPoint)",Marketing-Eco,Alibaba,市场部,"Munich,Germany",Nan
137,Alibaba Group-GDC Regional Strategic Consulting Expert EU,fTZbvyUZ4yRmVmg_DUiqwA%3D%3D,https://careers.alibaba.com/positionDetail.htm?positionId=fTZbvyUZ4yRmVmg_DUiqwA%3D%3D,"1. 围绕阿里海外核心电商及互联网生态，参与战略级业务与市场的定期专项分析与研究项目，通过行业与市场分析、公司分析等工作对重点业务领域的战略决策提供支持； 2. 负责在具体行业领域里跟踪部分全球重点品牌及企业集团的经营情况，通过定性及定量分析，对品牌及商家的全视角商业模型形成洞察，并推动平台生态策略、商业机制的形成与持续优化； 3. 负责参与维护及持续优化内外部专家资源，持续强化行业专家网络，打造电商及互联网领域的优秀智库； 4. 围绕全球互联网与新消费领域的重点行业趋势、商业模式等进行专题研究，对前沿商业形态进行前瞻性分析，挖掘并推动创新模式在平台的落地。 1. Conduct regular researches and studies around Alibaba overseas e-commerce business and Ecosystem. Provide strategic support through industry and market analysis, corporate studies and other major areas; 2. Continuously contribute to the optimization of Alibaba overseas platform strategy and business model by systematically keeping track of certain global key brands and enterprises operation, providing insights on brands and merchant's business models through qualitative and quantitative analysis; 3. Responsible for building the industry expert network, maintaining and upgrading the internal and external expert resources, thus, forming a strong internal think tank in the field of e-commerce and Internet; 4. Conduct researches and studies on the business model of innovative sectors in Internet and new retail, conduct perspective analysis on cutting-edge businesses, explore and promote the implementation of innovative models on the platform.",Nan,"1. 5年以上行业经验，有国际知名公司投资分析、策略研究或战略咨询经验；有国际知名投行，投资机构，互联网 / 消费领先公司、咨询公司从业经验者优先； 2. 有出色的商业洞察与研究能力，具备好奇心，对行业具备快速学习能力，拥有较为全面的数据分析、市场研究能力，特别在互联网 / 消费领域具有代表性项目者优先； 3. 有韧性，勇于承担具有挑战性的工作，愿意持续学习与成长； 4. 具备优秀的沟通协调能力，能够组织内外部各相关方形成良好合作并共同完成目标； 5. 需具备英语沟通能力，法语、西班牙语为加分项。 1. 5+ years working experience, have investment analysis, strategy research or strategy consulting experience in internationally renowned companies; Experiences in international investment banks, investment institutions, leading internet / retail companies, consulting firms is preferred; 2. Excellent business research capability. Curious, fast-learner, comprehensive data analysis and market research ability, project portfolio in the Internet / retail field is preferred; 3. Resilient, willing to take on challenging work, willing to learn and grow; 4. Excellent communication and coordination skills, able to collaborate with internal and external parties towards achieving the goals together. 6. English speaking and writing skills are required；Mandarin, French and Spanish are a plus.",Integration - Corporate affairs,Alibaba,战略部,"Madrid,Spain",Nan
138,Alibaba Group-GDC Regional Partnership Expert EU,sg9dArWw3PXqc5rcV1SzMw%3D%3D,https://careers.alibaba.com/positionDetail.htm?positionId=sg9dArWw3PXqc5rcV1SzMw%3D%3D,"1. 负责运营海外数字商业--欧洲市场的核心商家和代理运营商资源，在所负责的行业领域对接重点品牌商家的创始人及决策者，打造电商及互联网领域的优秀商家智库； 2. 跟踪海外-欧洲市场重点品牌及企业集团的经营情况，对品牌及商家的全视角商业模型形成洞察，定期收集商家反馈与需求，推动平台生态策略、商业机制的形成与持续优化； 3. 持续拓展并优化内外部商家资源，定期组织品牌与商家的核心决策者基于不同主题的深度商业讨论，为核心决策层的策略制定提供支持； 4. 联合内外部团队，对生态体系的内外部主要合作伙伴进行专题调研，识别业务痛点并形成策略，不断升级与合作伙伴的合作模式，优化生态体系结构。 1. To establish and maintain strong connection with key sellers and service partners decision level in European market，and build a high-quality seller think tank； 2. To monitor performance of key brands in European market and regularly gain an insight into commercial model, and collect sellers' feedbacks and requirements in order to develop platform strategy and improve commercial system continuously; 3. To explore and improve internal and external seller resources continuously, regularly organize sellers and brands commercial meetings and discussions with different topics that support commercial decisions； 4. To cooperate with internal and external teams and do thematic research, identify critical business issues and establish strategies;",Nan,"1. 5年以上行业经验，有知名消费品牌、零售、互联网行业经验者优先； 2. 具备优秀的沟通、理解与协调能力，擅长组织内外部资源去推进项目结果的达成； 3. 具备敏锐的商业洞察与研究能力，能够理解并挖掘品牌与商家需求，并系统性总结沉淀，拥有较为全面的行业与市场研究能力； 4. 有韧性，勇于承担具有挑战性的工作； 5. 有海外工作或者学习经验且愿意长期base海外和海外市场出差； 6. 英语读写能力为必备技能，法语、西语是加分项。 1. 5years+ working experience in top FMCG ,Retailing, Internet companies preferred 2. Excellent in communication, understanding, coordination and organizing internal and external resources to deliver program result; 3. Excellent in business sense, industry and local market research capabilities, understanding and exploring sellers' requirements to summarize systematically； 4. Overseas working or study experiences preferred； 5. accept to base overseas and travel around Southeast Asia market； 6. English speaking and writing skills are required；French or Spanish is a plus.",Operation-Partner Management,Alibaba,战略部,"Madrid,Spain",Nan
139,"Ant Group Senior Solution Engineer, Alipay+ International BG",d0ZQDRCMClaXeUbQPX0KFw%3D%3D,https://careers.alibaba.com/positionDetail.htm?positionId=d0ZQDRCMClaXeUbQPX0KFw%3D%3D,"AlipayPlus (A+) is an Ant Group global mobile-first payment and marketing solution, growing from the leading pioneers of the mobile payment industry. A+ provides a common standard and set of rules applied to all partners that facilitate operational efficiency, one-stop integration for expanded merchant acceptance, and effective marketing tools that deliver attractive digital merchant offers to mobile payment users ( [URL] implementation",Nan,"Minimum Qualifications - BS / MS degree in Computer Science, Engineering or related subjects - 4-8 years of working experience with 2-4 years doing hands-on software development - Good fundamentals and hands-on experiences with API integration, database, web security, application design and troubleshooting - Ability to manage internal or external clients and communicate effectively with both technical and business teams - Demonstrated ability to convert business requirements into technical specifications - Ability to assess current product and technology gaps and come up with the best technical solution - Proficient in English (oral / written) Preferred Qualifications - Demonstrate good business sense and passion for using various technical solutions to fulfil business needs - Willingness to communicate with global teams. Ability to converse in both English and Mandarin to communicate with our Mandarin-speaking stakeholders - Knowledge of mobile development is an added advantage - Proven experience in managing external vendors is an added advantage - Familiar with Fintech technology, a firm understanding of the payments industry, and experience in large scale payment / e-commerce related domains is an added advantage - Familiar with Southeast Asia banking / payment infrastructure is an added advantage - Result oriented, adaptable and able to embrace changes. Strong in multi-tasking and perform well under pressure",Technology - Development,Alibaba,东南亚和南亚售前解决方案,"Singapore,Singapore",Nan
140,Ant Group Compliance Officer International BG,iJ2tmSUzoNqFZksNcmv4qg%3D%3D,https://careers.alibaba.com/positionDetail.htm?positionId=iJ2tmSUzoNqFZksNcmv4qg%3D%3D,"Job Description Based in Hong Kong, he / she will be part of a growing and dynamic Hong Kong Compliance team providing compliance support to Ant Group remittance and payments business in Hong Kong. The person reports directly to the Regional Compliance Head - Hong Kong and North East Asia (“NEA”). We are looking to hire a detail-oriented, hard-working senior compliance professional to maintain the regulatory compliance programme of a Money Service Operator licensed entity in Hong Kong, working closely with key stakeholders from business development, operation, legal, risk management and other teams to support the growth strategies of the business unit. There are also opportunities to work on NEA regional projects, providing compliance advice and supporting our international expansion initiatives in the region. The ideal candidate will be a confident self-starter with strong interpersonal and organizational skills, and demonstrate the ability to effectively and proactively exercise good judgment and partner with the business in a fast-paced environment. Key responsibilities: - Develop and maintain robust regulatory compliance programme - Keep abreast of internal standards and business goals and maintain required compliance policies and key obligation registers, ensuring policies and procedures are reviewed and updated as appropriate to meet relevant regulatory requirements - Track and review regulatory changes (including regulations, notices, guidelines) relating to the businesses in Hong Kong and NEA, perform impact analysis and communicate changes to relevant functions, and oversee required changes as appropriate - Act as a key contact point for compliance queries and advice, partnering with business teams to deliver key business initiatives, including new products, new markets / regions and process improvements. - Review regulatory returns and filings to ensure they are accurate and submitted in line with regulatory timescales, working closely with the finance, corporate governance and other teams - Develop and conduct regular and risk-based compliance reviews to monitor the regulatory risks - Contribute to consultation paper responses and liaise with regulators as appropriate - Conduct and record compliance incident reviews, escalating them in line with agreed procedures, and submitting notifications to relevant regulators as required - Provide training across the business to embed policies and maintain the strong compliance culture - Provide advice and support regional business initiatives as appropriate",Nan,"- Bachelor Degree in Accounting, Business or Finance, Law; or equivalent work or legal experience - At least 10 years of relevant compliance, regulatory, advisory or similar experience - Strong regulatory / compliance knowledge and skills - Knowledge of Fintech, HK money transfer operator and stored value licensing or similar regulatory landscape; experience with e-commerce, payments or financial services is beneficial - Experience in risk management is a plus - Team player and ability to work independently - Open to tackle new issues and sounding out new ideas - Ability to work under pressure and meet deadlines - Excellent command of both spoken and written English and preferably Mandarin Chinese - Some travelling within NEA and China to be expected",Integration - Legal affairs,Alibaba,香港区域及WF业务合规,Hong Kong,Nan
141,Ant Group Investment Associate Director Technology,rkhrtuWuuRIMkjlqnDfvdw%3D%3D,https://careers.alibaba.com/positionDetail.htm?positionId=rkhrtuWuuRIMkjlqnDfvdw%3D%3D,"We are now seeking for seasoned investment professionals to join ANT Group's investment department, and mainly cover technology investments globally. Specific responsibilities include: - Work with investment / business team to formulate overseas technology investment strategy that support the overall technology business to develope the platform and enhance the ecosystem - Source, screen and assess potential investment / merger leads and market intelligence that align with strategic direction - Drive execution process independently, including but not limited to due diligence, negotiation, and to prepare investment proposal and other documentations to support transaction - Manage and support portfolio companies, monitoring the operation and financial performance of existing investments, shaping the ongoing strategy with our portfolio companies",Nan,"- Working experience in top tier investment bank, private equity, venture capital, and technology companies with investment, merger, banking and consulting background - More than 5-year investment related experience, preferable deal experience in Blockchain, AI, Cyber-security, IoT, Cloud Computing or other technology (Enterprise Services) areas - Bachelor or above degree in Business, Economics, Finance, Computer Science and other related majors from prestigious universities - Proficiency in both English and Mandarin - Strong analytical, communication and presentation skill - Entrepreneurial, self-driven, ability to adopt changing environment, team player and strong commercial sense - Ability to travel globally frequently",Integration - Corporate affairs,Alibaba,投资部,"Singapore,Singapore",Nan
